{
  "version": "1.0",
  "success": true,
  "reason": null,
  "content": {
    "new_message_id": "AAMkAGVhZGFlNDVhLTI0MDAtNGE1Ni05Zjk3LTAxNzllYjFiNDAzYwBGAAAAAADG92SqC8zpQJ1GSk2scH2NBwDi5Xky9KHuQ48Uewaxv-e8AAAAAAETAADi5Xky9KHuQ48Uewaxv-e8AAApGtroAAA=",
    "new_web_link": "https://outlook.office365.com/owa/?ItemID=AAMkAGVhZGFlNDVhLTI0MDAtNGE1Ni05Zjk3LTAxNzllYjFiNDAzYwBGAAAAAADG92SqC8zpQJ1GSk2scH2NBwDi5Xky9KHuQ48Uewaxv%2Fe8AAAAAAETAADi5Xky9KHuQ48Uewaxv%2Fe8AAApGtroAAA%3D&exvsurl=1&viewmodel=ReadMessageItem"
  },
  "raw": "{\"new_message_id\": \"AAMkAGVhZGFlNDVhLTI0MDAtNGE1Ni05Zjk3LTAxNzllYjFiNDAzYwBGAAAAAADG92SqC8zpQJ1GSk2scH2NBwDi5Xky9KHuQ48Uewaxv-e8AAAAAAETAADi5Xky9KHuQ48Uewaxv-e8AAApGtroAAA=\", \"new_web_link\": \"https://outlook.office365.com/owa/?ItemID=AAMkAGVhZGFlNDVhLTI0MDAtNGE1Ni05Zjk3LTAxNzllYjFiNDAzYwBGAAAAAADG92SqC8zpQJ1GSk2scH2NBwDi5Xky9KHuQ48Uewaxv%2Fe8AAAAAAETAADi5Xky9KHuQ48Uewaxv%2Fe8AAApGtroAAA%3D&exvsurl=1&viewmodel=ReadMessageItem\"}",
  "inputs": {
    "exo_mailfolders_id": null,
    "exo_email_address": "soartester@reshydradev.onmicrosoft.com",
    "exo_destination_mailfolder_id": {
      "id": 185,
      "name": "archive"
    },
    "exo_messages_id": "AAMkAGVhZGFlNDVhLTI0MDAtNGE1Ni05Zjk3LTAxNzllYjFiNDAzYwBGAAAAAADG92SqC8zpQJ1GSk2scH2NBwDi5Xky9KHuQ48Uewaxv-e8AAAAAAEMAADi5Xky9KHuQ48Uewaxv-e8AAApGgUhAAA="
  },
  "metrics": {
    "version": "1.0",
    "package": "fn-exchange-online",
    "package_version": "1.4.0",
    "host": "Henry's IBM 16 inch Macbook Pro",
    "execution_time_ms": 1043,
    "timestamp": "2023-05-30 15:55:21"
  }
}